reject,sentence,sentence_original,mean_mem,low_mem_words,mid_mem_words,high_mem_words,index,original_index,has_edit
,Future law student at Denver University.,Future law Student at Denver University.,0.7897626266,,university,denver,,c4_-om2-data-public-allenai-c4-c4-en-c4-train.00196-of-01024.json.gz.02269788,True
,There's nearly 2 million in London.,There's nearly 2 million in London.,0.794778369,,,london,cornellmov.6.011417,cornellmov.0064732,False
,Nice bond between father and son.,Nice bond between father and son.,0.7910727938,,,son,,c4_-om2-data-public-allenai-c4-c4-en-c4-train.00961-of-01024.json.gz.03949599,False
,"No, son, I didn't get fired.","No, son, I didn't get fired.",0.7834586727,,,son,cornellmov.6.033386,cornellmov.0202997,False
,"Cairo, Egypt, for Mel Gibson - hello.","Cairo, Egypt, for Mel Gibson- hello.",0.8277895168,,gibson,cairo,cocaspok1995.6.004376,cocaspok1995.051184,True
,Texas FHA home loan limits vary.,Texas FHA Home Loan limits vary.,0.789638619,,,texas,,c4_-om2-data-public-allenai-c4-c4-en-c4-train.00491-of-01024.json.gz.03320916,True
,Remember the coalition attack in London?,Remember the coalition attack in London?,0.785360758,,,london,cocaspok2006.6.002690,cocaspok2006.0046079,False
,"Eastern time; in nearby Copiapo, pandemonium.","Eastern time; in nearby Copiapo, pandemonium.",0.7974119132,,,pandemonium,cocaspok2010.6.009940,cocaspok2010.0129684,False
,You do have a Capone robot.,You do have a Capone robot.,0.785546339,,,capone,cocaspok1993.6.009865,cocaspok1993.0138949,False
,And my son in intensive care.,And my son in intensive care.,0.7827057909,,,son,cocaspok1994.6.003520,cocaspok1994.0047587,False
,"Lovejoy with me, not Chili Palmer.","Lovejoy with me, not Chili Palmer.",0.7929429773,,,chili,cornellmov.6.018536,cornellmov.0107737,False
,Acute flaccid paralysis due to rabies.,Acute flaccid paralysis due to rabies.,0.780727591,,,rabies,,c4_-om2-data-public-allenai-c4-c4-en-c4-train.00491-of-01024.json.gz.03510678,False
,Cute pic with the camera too.,Cute pic with the camera too.,0.785068681,,,cute,,c4_-om2-data-public-allenai-c4-c4-en-c4-train.00480-of-01024.json.gz.03075320,False
,Each bowl is handmade in Peru.,Each bowl is handmade in Peru.,0.7885949172,,,peru,,c4_-om2-data-public-allenai-c4-c4-en-c4-train.00727-of-01024.json.gz.02303898,False
,This is from Flips in Philadelphia.,This is from Flips in Philadelphia.,0.7989763496,,,philadelphia,cocaspok2000.6.005957,cocaspok2000.0097103,False
,"Barbara meyers, Marriage, old dogs, retirement.","Barbara meyers, Marriage, old dogs, retirement.",0.8198987404,,,barbara,,c4_-om2-data-public-allenai-c4-c4-en-c4-train.00196-of-01024.json.gz.01525213,False
,"Gary Strieker reports from Kotzebue, Alaska.","Gary Strieker reports from Kotzebue, Alaska.",0.7997259064,,gary,alaska,cocaspok2004.6.004708,cocaspok2004.0074103,False
,"Friday, September 13th, 2013 at 4:38pm.","Friday, September 13th, 2013 at 4:38pm.",0.8452454071,,,september,,c4_-om2-data-public-allenai-c4-c4-en-c4-train.00491-of-01024.json.gz.03518410,False
,The capital of Ohio is Columbus.,The capital of Ohio is Columbus.,0.78100689,,,ohio,cocaspok2000.6.001085,cocaspok2000.0020370,False
,"Wait a sec, Nicky, Nicky, Nicky.","Wait a sec, Nicky, Nicky, Nicky.",0.8014574231,,,sec,cornellmov.6.028261,cornellmov.0170627,False
,"His grin flashed, cocksure and sexy.","His grin flashed, cocksure and sexy.",0.7823599223,,,sexy,torontofantasy.6.431771,torontofantasy.5694865,False
,"Congressman Henry Hyde, Republican of Illinois.","Congressman Henry Hyde, Republican of Illinois.",0.7902283713,,,illinois,cocaspok2001.6.007370,cocaspok2001.0111863,False
,Who -- that guy at the Zoo?,Who -- that guy at the Zoo?,0.7825692959,,,guy,cornellmov.6.001975,cornellmov.0011172,False
,Texas steak dinner on a stick?,Texas Steak Dinner on a Stick:?,0.7837251456,,,texas,,c4_-om2-data-public-allenai-c4-c4-en-c4-train.00480-of-01024.json.gz.01206833,True
,Your men did kill Kirk's son.,Your men did kill Kirk's son.,0.7965491163,,,son,cornellmov.6.024271,cornellmov.0144904,False
,Titanium Metals is a titanium producer.,Titanium Metals is a titanium producer.,0.7893829899,,,"titanium,titanium",wsj.6.002284,wsj.415491,False
,Free puck retrieved by Matt Niskanen.,Free Puck Retrieved by Matt Niskanen.,0.8043018945,free,,matt,,c4_-om2-data-public-allenai-c4-c4-en-c4-train.00242-of-01024.json.gz.03790610,True
,Or read tweets about Santa Barbara?,Or read tweets about Santa Barbara?,0.789252623,,,barbara,,c4_-om2-data-public-allenai-c4-c4-en-c4-train.00727-of-01024.json.gz.04036368,False
,We'll go to Gary in Tennessee.,We'll go to Gary in Tennessee.,0.7948908799,,gary,tennessee,cocaspok1993.6.009485,cocaspok1993.0132803,False
,Vinny looked like a symphony conductor.,Vinny looked like a symphony conductor.,0.7855937941,,,vinny,torontomyst.6.010076,torontomyst.140486,False
,Delicious Estonian cake full of blueberries.,Delicious Estonian cake full of Blueberries.,0.7944375226,full,,blueberries,,c4_-om2-data-public-allenai-c4-c4-en-c4-train.00196-of-01024.json.gz.02912988,True
,I'm doing this for my son.,I'm doing this for my son.,0.7836251108,,,son,torontofantasy.6.004857,torontofantasy.66621,False
