sentence,condition,correct,sent_identifier,index,original_index,item_id
Such a clean and simple method!,low,0.7777777777777778,,low.02095,c4_-om2-data-public-allenai-c4-c4-en-c4-train.00514-of-01024.json.gz.03864728,2095
The most economical seat we offer.,low,0.8909090909090909,,low.02096,c4_-om2-data-public-allenai-c4-c4-en-c4-train.00368-of-01024.json.gz.03008606,2096
Purchase energy efficient equipment whenever possible.,low,0.8235294117647058,,low.02097,c4_-om2-data-public-allenai-c4-c4-en-c4-train.00727-of-01024.json.gz.04761154,2097
"Our strong point, our value proposition.",low,0.711864406779661,cocaspok2005.6.005684,low.02098,cocaspok2005.0089127,2098
Better if I just show you.,low,0.7368421052631579,cornellmov.6.001484,low.02099,cornellmov.0008126,2099
It must be getting more serious.,low,0.5625,brown.6.001172,low.02100,brown.023082,2100
You must not diverge any further.,low,0.782051282051282,torontofantasy.6.152299,low.02101,torontofantasy.2072808,2101
It might be too late already.,low,0.8064516129032258,cornellmov.6.023739,low.02102,cornellmov.0141422,2102
Perhaps one or two stayed behind.,low,0.7333333333333333,torontoadv.6.032901,low.02103,torontoadv.565382,2103
I'd always give them their due.,low,0.7,cocaspok2001.6.001607,low.02104,cocaspok2001.0029119,2104
No obstacles remained ahead of her.,low,0.7887323943661971,torontofantasy.6.325226,low.02105,torontofantasy.4255488,2105
They've got a very strong theme.,low,0.6716417910447762,cocaspok2007.6.005948,low.02106,cocaspok2007.0079628,2106
"Still talking, but unable to hear.",low,0.7547169811320755,torontofantasy.6.029004,low.02107,torontofantasy.422983,2107
What you describe is not unusual.,low,0.7123287671232876,,low.02108,c4_-om2-data-public-allenai-c4-c4-en-c4-train.00727-of-01024.json.gz.03924043,2108
They must not come to harm.,low,0.72,torontofantasy.6.462577,low.02109,torontofantasy.6015944,2109
Public in a timely a manner.,low,0.75,,low.02110,c4_-om2-data-public-allenai-c4-c4-en-c4-train.00514-of-01024.json.gz.04151379,2110
Everyone wants to protect me lately.,low,0.7948717948717948,torontofantasy.6.178851,low.02111,torontofantasy.2435901,2111
His voice was full of concern.,low,0.7037037037037037,torontofantasy.6.229738,low.02112,torontofantasy.3069087,2112
He forced you to crave him.,low,0.8,torontofantasy.6.134026,low.02113,torontofantasy.1835671,2113
They played cards for several hours.,low,0.8367346938775511,,low.02114,c4_-om2-data-public-allenai-c4-c4-en-c4-train.00727-of-01024.json.gz.01632667,2114
That would perhaps eliminate the will.,low,0.7948717948717948,cocaspok1993.6.002509,low.02115,cocaspok1993.0034546,2115
Not a hint of life remained.,low,0.7666666666666667,torontofantasy.6.353621,low.02116,torontofantasy.4646449,2116
Is that easy enough for you?,low,0.6746987951807228,,low.02117,c4_-om2-data-public-allenai-c4-c4-en-c4-train.00470-of-01024.json.gz.00942275,2117
Or arrogantly presuming I desire you?,low,0.71875,torontofantasy.6.303233,low.02118,torontofantasy.3971005,2118
But I forced myself to breathe.,low,0.6833333333333333,torontofantasy.6.294818,low.02119,torontofantasy.3852621,2119
But whenever he was with her...,low,0.7580645161290323,torontofantasy.6.223939,low.02120,torontofantasy.2998495,2120
Well we must be missing somebody.,low,0.7924528301886793,cocaspok2006.6.006656,low.02121,cocaspok2006.0104979,2121
The firing was brief and precise.,low,0.7654320987654321,,low.02122,c4_-om2-data-public-allenai-c4-c4-en-c4-train.00480-of-01024.json.gz.00168008,2122
Would you accept extremely difficult instead?,low,0.6666666666666666,torontofantasy.6.414306,low.02123,torontofantasy.5431444,2123
Certainly it is a formal step.,low,0.6533333333333333,cocaspok2006.6.005379,low.02124,cocaspok2006.0086254,2124
Panic rooted me to the spot.,low,0.6666666666666666,torontofantasy.6.105109,low.02125,torontofantasy.1516304,2125
He has a very powerful ship.,low,0.9047619047619048,cornellmov.6.018481,low.02126,cornellmov.0107256,2126
They are tending to the wounded.,low,0.726027397260274,cocaspok1998.6.010182,low.02127,cocaspok1998.0137229,2127
We know it will be delightful.,low,0.6794871794871795,,low.02128,c4_-om2-data-public-allenai-c4-c4-en-c4-train.00196-of-01024.json.gz.01098782,2128
The remnants of a life raft.,low,0.7692307692307693,cornellmov.6.035431,low.02129,cornellmov.0216208,2129
It also promotes critical thinking skills.,low,0.7450980392156863,,low.02130,c4_-om2-data-public-allenai-c4-c4-en-c4-train.00470-of-01024.json.gz.04116842,2130
I tried for a quick recovery.,low,0.7647058823529411,torontofantasy.6.456849,low.02131,torontofantasy.5933636,2131
This was a very strong case.,low,0.7792207792207793,cocaspok1998.6.004789,low.02132,cocaspok1998.0064464,2132
"First of all, we are bewildered.",low,0.782051282051282,cocaspok1998.6.002043,low.02133,cocaspok1998.0028465,2133
The usual chatter has been suspended.,low,0.7023809523809523,torontofantasy.6.151496,low.02134,torontofantasy.2061992,2134
Hail is a particularly strong foe.,low,0.8709677419354839,,low.02135,c4_-om2-data-public-allenai-c4-c4-en-c4-train.00196-of-01024.json.gz.00145152,2135
Thanks every one for your suggestions.,low,0.7142857142857143,,low.02136,c4_-om2-data-public-allenai-c4-c4-en-c4-train.00961-of-01024.json.gz.02320321,2136
Confirm that the list is accurate.,low,0.7192982456140351,,low.02137,c4_-om2-data-public-allenai-c4-c4-en-c4-train.00727-of-01024.json.gz.03164416,2137
Quick with a moral and advice.,low,0.82,torontofantasy.6.205154,low.02138,torontofantasy.2778295,2138
You must not have heard me.,low,0.6463414634146342,cocaspok1994.6.005443,low.02139,cocaspok1994.0069214,2139
A surprising and extremely unusual strategy.,low,0.7297297297297297,cocaspok2011.6.000304,low.02140,cocaspok2011.0003285,2140
The guards won't be any problem.,low,0.8133333333333334,torontofantasy.6.411167,low.02141,torontofantasy.5387658,2141
I'm still trying to catch up.,low,0.625,,low.02142,c4_-om2-data-public-allenai-c4-c4-en-c4-train.00491-of-01024.json.gz.00447156,2142
I guarantee you will feel better.,low,0.7169811320754716,,low.02143,c4_-om2-data-public-allenai-c4-c4-en-c4-train.00242-of-01024.json.gz.04457050,2143
Both companies will sell the software.,low,0.8656716417910447,wsj.6.000878,low.02144,wsj.159865,2144
Some of them are extremely tall.,low,0.782608695652174,,low.02145,c4_-om2-data-public-allenai-c4-c4-en-c4-train.00918-of-01024.json.gz.03144900,2145
"I heard them leave, of course.",low,0.6904761904761905,torontofantasy.6.420979,low.02146,torontofantasy.5552131,2146
But it was not peaceful sleep.,low,0.8461538461538461,torontofantasy.6.031921,low.02147,torontofantasy.465730,2147
Every sort of inner organ imaginable.,low,0.8688524590163934,torontofantasy.6.112614,low.02148,torontofantasy.1613822,2148
And they had many phone conferences.,low,0.71875,cocaspok2005.6.004551,low.02149,cocaspok2005.0072043,2149
I've tried every sort of cable.,low,0.7678571428571429,,low.02150,c4_-om2-data-public-allenai-c4-c4-en-c4-train.00961-of-01024.json.gz.01184854,2150
"Always smile, never be too serious.",low,0.8309859154929577,,low.02151,c4_-om2-data-public-allenai-c4-c4-en-c4-train.00727-of-01024.json.gz.03545498,2151
Well... So you tried riding again?,low,0.7283950617283951,cornellmov.6.009874,low.02152,cornellmov.0056235,2152
You must not be thinking clearly.,low,0.64,cornellmov.6.039685,low.02153,cornellmov.0244223,2153
Trouble viewing or accessing a service?,low,0.819672131147541,,low.02154,c4_-om2-data-public-allenai-c4-c4-en-c4-train.00242-of-01024.json.gz.01912464,2154
As opposed to being more spiritual.,low,0.7142857142857143,cocaspok2009.6.005958,low.02155,cocaspok2009.0076118,2155
It's been a shock to everyone.,low,0.6710526315789473,,low.02156,c4_-om2-data-public-allenai-c4-c4-en-c4-train.00242-of-01024.json.gz.04845097,2156
The pressure must have been enormous.,low,0.7534246575342466,cocaspok2003.6.006201,low.02157,cocaspok2003.0094285,2157
They're not going to hurt me.,low,0.6575342465753424,torontofantasy.6.267301,low.02158,torontofantasy.3521680,2158
It should leave a clear trail.,low,0.7,torontofantasy.6.322226,low.02159,torontofantasy.4223409,2159
Let me give you a hypothetical.,low,0.8297872340425532,torontomyst.6.035551,low.02160,torontomyst.503582,2160
Change them if they become damp.,low,0.8,,low.02161,c4_-om2-data-public-allenai-c4-c4-en-c4-train.00918-of-01024.json.gz.03398446,2161
Its remains are still visible today.,low,0.7619047619047619,,low.02162,c4_-om2-data-public-allenai-c4-c4-en-c4-train.00470-of-01024.json.gz.04583692,2162
We are responsive to community concerns.,low,0.8055555555555556,,low.02163,c4_-om2-data-public-allenai-c4-c4-en-c4-train.00727-of-01024.json.gz.00125036,2163
It must be close to dawn.,low,0.7446808510638298,torontofantasy.6.336350,low.02164,torontofantasy.4412462,2164
Repeat if needed for full coverage.,low,0.8163265306122449,,low.02165,c4_-om2-data-public-allenai-c4-c4-en-c4-train.00470-of-01024.json.gz.02244582,2165
Intended for and available to everyone.,low,0.6666666666666666,,low.02166,c4_-om2-data-public-allenai-c4-c4-en-c4-train.00727-of-01024.json.gz.01699666,2166
It was very clean and modern.,low,0.7096774193548387,,low.02167,c4_-om2-data-public-allenai-c4-c4-en-c4-train.00368-of-01024.json.gz.00894170,2167
Learning to forgive benefits everyone involved.,low,0.6901408450704225,,low.02168,c4_-om2-data-public-allenai-c4-c4-en-c4-train.00918-of-01024.json.gz.02272708,2168
The key to survival is moderation.,low,0.8983050847457628,torontofantasy.6.362887,low.02169,torontofantasy.4749453,2169
What experience remained to be seen.,low,0.6329113924050633,torontofantasy.6.408241,low.02170,torontofantasy.5344328,2170
The wound couldn't be that serious.,low,0.6341463414634146,torontofantasy.6.469730,low.02171,torontofantasy.6100981,2171
I have to clean it up.,low,0.7254901960784313,torontofantasy.6.386761,low.02172,torontofantasy.5068113,2172
How do we become a customer?,low,0.8275862068965517,,low.02173,c4_-om2-data-public-allenai-c4-c4-en-c4-train.00368-of-01024.json.gz.03562544,2173
The second guard waved them past.,low,0.7903225806451613,torontofantasy.6.462741,low.02174,torontofantasy.6017854,2174
I get emails from them constantly.,low,0.8,,low.02175,c4_-om2-data-public-allenai-c4-c4-en-c4-train.00470-of-01024.json.gz.04450581,2175
How soon will you be ready?,low,0.6567164179104478,cornellmov.6.018985,low.02176,cornellmov.0110790,2176
I go through without any alarms.,low,0.7692307692307693,,low.02177,c4_-om2-data-public-allenai-c4-c4-en-c4-train.00961-of-01024.json.gz.00623669,2177
But the procedure isn't for everyone.,low,0.7974683544303798,cocaspok2004.6.008069,low.02178,cocaspok2004.0119471,2178
It is such a great feeling.,low,0.6119402985074627,cocaspok2009.6.007504,low.02179,cocaspok2009.0095892,2179
We have one slight problem though.,low,0.7,torontoadv.6.041981,low.02180,torontoadv.715747,2180
I would recommend Nadia's to everyone!,low,0.8431372549019608,,low.02181,c4_-om2-data-public-allenai-c4-c4-en-c4-train.00196-of-01024.json.gz.01795065,2181
He wanted to keep this serious.,low,0.7468354430379747,torontofantasy.6.079874,low.02182,torontofantasy.1178694,2182
"He was so strong, so commanding.",low,0.8024691358024691,torontofantasy.6.214391,low.02183,torontofantasy.2893101,2183
To give your anger a voice.,low,0.7796610169491526,cornellmov.6.038430,low.02184,cornellmov.0235755,2184
"Sounds just a little complicated, appropriate?",low,0.6764705882352942,,low.02185,c4_-om2-data-public-allenai-c4-c4-en-c4-train.00727-of-01024.json.gz.00529914,2185
He would be easy to manage.,low,0.7647058823529411,torontoadv.6.019513,low.02186,torontoadv.349018,2186
He was giving them full employment.,low,0.8048780487804879,cocaspok1993.6.008853,low.02187,cocaspok1993.0121950,2187
And getting better all the time.,low,0.8095238095238095,cornellmov.6.019018,low.02188,cornellmov.0111012,2188
They are usually easy to access.,low,0.696969696969697,,low.02189,c4_-om2-data-public-allenai-c4-c4-en-c4-train.00196-of-01024.json.gz.00363393,2189
Some groups also hold suspension performances.,low,0.6779661016949152,,low.02190,c4_-om2-data-public-allenai-c4-c4-en-c4-train.00961-of-01024.json.gz.03793389,2190
Everyone had been working so hard.,low,0.6515151515151515,torontomyst.6.034786,low.02191,torontomyst.493019,2191
Evelyn pained expression focused on me.,low,0.6376811594202898,torontomyst.6.055620,low.02192,torontomyst.774149,2192
He'd give you a flippant answer.,low,0.8148148148148148,torontofantasy.6.331350,low.02193,torontofantasy.4334790,2193
Give them perspective on their relationship.,low,0.7142857142857143,torontoadv.6.053318,low.02194,torontoadv.895319,2194
We're still asking folks to leave.,low,0.7346938775510204,cocaspok2005.6.002313,low.02195,cocaspok2005.0040563,2195
Yet the outcome can be unpredictable.,low,0.66,wsj.6.000723,low.02196,wsj.132603,2196
Their apps on a daily basis.,low,0.7142857142857143,,low.02197,c4_-om2-data-public-allenai-c4-c4-en-c4-train.00480-of-01024.json.gz.03677081,2197
You will never leave our minds.,low,0.6857142857142857,,low.02198,c4_-om2-data-public-allenai-c4-c4-en-c4-train.00480-of-01024.json.gz.00499317,2198
We get the attention we desire.,low,0.8620689655172413,,low.02199,c4_-om2-data-public-allenai-c4-c4-en-c4-train.00196-of-01024.json.gz.02533874,2199
My skin felt smooth and clean.,low,0.8888888888888888,,low.02200,c4_-om2-data-public-allenai-c4-c4-en-c4-train.00480-of-01024.json.gz.04856489,2200
So give unselfishly and receive abundantly.,low,0.8333333333333334,,low.02201,c4_-om2-data-public-allenai-c4-c4-en-c4-train.00727-of-01024.json.gz.02250619,2201
Of course we were all concerned.,low,0.6949152542372882,torontomyst.6.139158,low.02202,torontomyst.1804703,2202
"Well, give a couple of minutes...",low,0.631578947368421,cornellmov.6.006351,low.02203,cornellmov.0036107,2203
We are concerned with higher matters.,low,0.6666666666666666,torontofantasy.6.090934,low.02204,torontofantasy.1340894,2204
I excused myself to the restroom.,low,0.8135593220338984,torontofantasy.6.080331,low.02205,torontofantasy.1185920,2205
We constantly improve update our content.,low,0.7837837837837838,,low.02206,c4_-om2-data-public-allenai-c4-c4-en-c4-train.00196-of-01024.json.gz.01633462,2206
It's not going to be easy.,low,0.6493506493506493,cocaspok1998.6.009453,low.02207,cocaspok1998.0124555,2207
And I struggle to walk properly.,low,0.8958333333333334,torontoadv.6.002056,low.02208,torontoadv.40386,2208
Your leg must be getting better.,low,0.8095238095238095,cornellmov.6.007140,low.02209,cornellmov.0040902,2209
I was feeling a little better.,low,0.6923076923076923,torontomyst.6.030545,low.02210,torontomyst.436181,2210
Select the best suitable company offering.,low,0.7115384615384616,,low.02211,c4_-om2-data-public-allenai-c4-c4-en-c4-train.00196-of-01024.json.gz.00937098,2211
She's kind of afraid of people.,low,0.825,cocaspok1990.6.007033,low.02212,cocaspok1990.0126080,2212
"Larry, you just take it easy.",low,0.8157894736842105,cornellmov.6.008779,low.02213,cornellmov.0050333,2213
We are concerned here -- let's focus.,low,0.7586206896551724,cocaspok1997.6.008226,low.02214,cocaspok1997.0096742,2214
Are you afraid of growing competition?,low,0.8387096774193549,,low.02215,c4_-om2-data-public-allenai-c4-c4-en-c4-train.00480-of-01024.json.gz.01499799,2215
But everything is also getting better.,low,0.734375,cornellmov.6.017951,low.02216,cornellmov.0103867,2216
Thank you for a thoughtful piece.,low,0.8,,low.02217,c4_-om2-data-public-allenai-c4-c4-en-c4-train.00242-of-01024.json.gz.02087054,2217
Then you'd better start believing me.,low,0.6282051282051282,cornellmov.6.001998,low.02218,cornellmov.0011270,2218
Give the best first impression possible.,low,0.75,,low.02219,c4_-om2-data-public-allenai-c4-c4-en-c4-train.00196-of-01024.json.gz.00829665,2219
Give her a couple of hours.,low,0.7051282051282052,cornellmov.6.029211,low.02220,cornellmov.0176798,2220
"Then they're not separated, are they?",low,0.8208955223880597,cornellmov.6.012071,low.02221,cornellmov.0068601,2221
His expression clearly showed his confusion.,low,0.6923076923076923,torontoadv.6.047485,low.02222,torontoadv.798840,2222
Sort of low to medium heat.,low,0.7733333333333333,cocaspok2002.6.006468,low.02223,cocaspok2002.0098285,2223
I wanted you to be real.,low,0.7215189873417721,cornellmov.6.019777,low.02224,cornellmov.0115744,2224
"For instance, to, too, and two.",low,0.96,,low.02225,c4_-om2-data-public-allenai-c4-c4-en-c4-train.00470-of-01024.json.gz.02705189,2225
Unless he'd been afraid they'd know.,low,0.5974025974025974,torontofantasy.6.101660,low.02226,torontofantasy.1471134,2226
"Another, better moment would present itself.",low,0.6842105263157895,torontofantasy.6.244962,low.02227,torontofantasy.3250020,2227
We should keep our expectations low.,low,0.6739130434782609,,low.02228,c4_-om2-data-public-allenai-c4-c4-en-c4-train.00368-of-01024.json.gz.01626703,2228
"To give her some space, but...",low,0.7333333333333333,torontofantasy.6.449201,low.02229,torontofantasy.5839980,2229
For a moment the room spun.,low,0.7875,torontomyst.6.009114,low.02230,torontomyst.125516,2230
Give her some of your strength.,low,0.7435897435897436,torontofantasy.6.410970,low.02231,torontofantasy.5384610,2231
Students must have good communication skills.,low,0.8493150684931506,,low.02232,c4_-om2-data-public-allenai-c4-c4-en-c4-train.00480-of-01024.json.gz.02229645,2232
"Indeed, nothing worth having comes easy.",low,0.72,,low.02233,c4_-om2-data-public-allenai-c4-c4-en-c4-train.00196-of-01024.json.gz.03115754,2233
But isn't quick weight loss dangerous?,low,0.9591836734693877,,low.02234,c4_-om2-data-public-allenai-c4-c4-en-c4-train.00918-of-01024.json.gz.02314684,2234
You must have been very proud.,low,0.71875,cornellmov.6.015205,low.02235,cornellmov.0086658,2235
I could barely focus or function.,low,0.7611940298507462,torontofantasy.6.312367,low.02236,torontofantasy.4100015,2236
His dreams were growing more powerful.,low,0.7945205479452054,torontofantasy.6.340970,low.02237,torontofantasy.4491098,2237
I must insist you try some.,low,0.691358024691358,cornellmov.6.016479,low.02238,cornellmov.0094502,2238
We want to make it better.,low,0.5555555555555556,cocaspok2006.6.008827,low.02239,cocaspok2006.0135524,2239
But you just made strong statements.,low,0.6582278481012658,cocaspok1990.6.003363,low.02240,cocaspok1990.0050883,2240
You are very easy to understand.,low,0.7368421052631579,,low.02241,c4_-om2-data-public-allenai-c4-c4-en-c4-train.00727-of-01024.json.gz.02166890,2241
A danger that was nearly tangible.,low,0.62,torontofantasy.6.302818,low.02242,torontofantasy.3964312,2242
Still there are plenty of critics.,low,0.7258064516129032,wsj.6.001328,low.02243,wsj.243956,2243
Some individuals prefer utilizing thoughts maps.,low,0.8363636363636363,,low.02244,c4_-om2-data-public-allenai-c4-c4-en-c4-train.00727-of-01024.json.gz.00804228,2244
That's already been taken care of.,low,0.759493670886076,cornellmov.6.031419,low.02245,cornellmov.0190708,2245
"Arrogant, sometimes ruthless people, but still.",low,0.7530864197530864,torontofantasy.6.300400,low.02246,torontofantasy.3937471,2246
There were signs of a struggle.,low,0.7283950617283951,torontomyst.6.147489,low.02247,torontomyst.1902458,2247
"""It'll give you nightmares,"" he advised.",low,0.7875,torontofantasy.6.347853,low.02248,torontofantasy.4572412,2248
But still it wasn't nearly enough.,low,0.5573770491803278,wsj.6.001648,low.02249,wsj.301245,2249
I couldn't hold back any longer.,low,0.6538461538461539,torontofantasy.6.284559,low.02250,torontofantasy.3702658,2250
"I feel his presence, so strong...",low,0.8360655737704918,cornellmov.6.024522,low.02251,cornellmov.0146526,2251
There were still several familiar faces.,low,0.68,torontofantasy.6.187906,low.02252,torontofantasy.2551732,2252
Some have done some remarkable things.,low,0.8,cocaspok2003.6.004445,low.02253,cocaspok2003.0070939,2253
Create amazing logos quick and easily.,low,0.9166666666666666,,low.02254,c4_-om2-data-public-allenai-c4-c4-en-c4-train.00196-of-01024.json.gz.03696776,2254
You still had to prove yourself.,low,0.5901639344262295,cornellmov.6.025919,low.02255,cornellmov.0155477,2255
Such features make dramatic selling points.,low,0.7727272727272727,wsj.6.002644,low.02256,wsj.479456,2256
They better be ready for me.,low,0.7468354430379747,torontofantasy.6.363149,low.02257,torontofantasy.4751957,2257
"A single mind, a single focus.",low,0.7402597402597403,torontomyst.6.047539,low.02258,torontomyst.667855,2258
Disbelief only better served its purpose.,low,0.6363636363636364,torontoadv.6.022294,low.02259,torontoadv.395853,2259
Allow the battery to recharge overnight.,low,0.8333333333333334,,low.02260,c4_-om2-data-public-allenai-c4-c4-en-c4-train.00470-of-01024.json.gz.02086783,2260
"Strong wind, freezing rain and snow.",low,0.8028169014084507,cocaspok2011.6.009063,low.02261,cocaspok2011.0115228,2261
Have you drawn all your life?,low,0.8235294117647058,,low.02262,c4_-om2-data-public-allenai-c4-c4-en-c4-train.00368-of-01024.json.gz.00032296,2262
Even the beast seemed less afraid.,low,0.7692307692307693,torontofantasy.6.052863,low.02263,torontofantasy.769064,2263
Five of those are critically wounded.,low,0.7777777777777778,cocaspok2002.6.004096,low.02264,cocaspok2002.0064868,2264
It is round and relatively small.,low,0.8133333333333334,,low.02265,c4_-om2-data-public-allenai-c4-c4-en-c4-train.00196-of-01024.json.gz.00463689,2265
Getting to your session is easy.,low,0.78,,low.02266,c4_-om2-data-public-allenai-c4-c4-en-c4-train.00491-of-01024.json.gz.03425111,2266
His policies are out of touch.,low,0.6623376623376623,cocaspok2012.6.003493,low.02267,cocaspok2012.042683,2267
"I'm not afraid of failure, no.",low,0.7142857142857143,cocaspok2011.6.006075,low.02268,cocaspok2011.0076762,2268
Had he calculated correctly for once?,low,0.7592592592592593,torontomyst.6.098967,low.02269,torontomyst.1312574,2269
Great success tonight upon first attempt..,low,0.631578947368421,,low.02270,c4_-om2-data-public-allenai-c4-c4-en-c4-train.00918-of-01024.json.gz.02010395,2270
But still Tom seemed to hesitate.,low,0.6811594202898551,torontomyst.6.139655,low.02271,torontomyst.1809910,2271
The application is easy to use.,low,0.7794117647058824,,low.02272,c4_-om2-data-public-allenai-c4-c4-en-c4-train.00480-of-01024.json.gz.01903559,2272
And we can get even better.,low,0.711864406779661,cornellmov.6.037064,low.02273,cornellmov.0226935,2273
Shipping was quick and easy too.,low,0.75,,low.02274,c4_-om2-data-public-allenai-c4-c4-en-c4-train.00368-of-01024.json.gz.02503098,2274
"He appeared startled, but seemingly unharmed.",low,0.6779661016949152,torontofantasy.6.130370,low.02275,torontofantasy.1785565,2275
"It was clean, bright and comfortable.",low,0.7792207792207793,,low.02276,c4_-om2-data-public-allenai-c4-c4-en-c4-train.00491-of-01024.json.gz.04640240,2276
It sends its own valuable signal.,low,0.6470588235294118,,low.02277,c4_-om2-data-public-allenai-c4-c4-en-c4-train.00480-of-01024.json.gz.04433165,2277
Because we're almost out of time.,low,0.6712328767123288,cocaspok2006.6.007604,low.02278,cocaspok2006.0118629,2278
We give you peace of mind.,low,0.6753246753246753,,low.02279,c4_-om2-data-public-allenai-c4-c4-en-c4-train.00196-of-01024.json.gz.01642319,2279
Focus on breathing deeply and slowly.,low,0.8627450980392157,,low.02280,c4_-om2-data-public-allenai-c4-c4-en-c4-train.00514-of-01024.json.gz.01272802,2280
Its improper use cannot be tolerated.,low,0.6774193548387096,,low.02281,c4_-om2-data-public-allenai-c4-c4-en-c4-train.00491-of-01024.json.gz.03992143,2281
His eyes were harsh and biting.,low,0.7926829268292683,torontofantasy.6.221613,low.02282,torontofantasy.2974194,2282
And you'd be correct every time.,low,0.8412698412698413,cocaspok1994.6.000833,low.02283,cocaspok1994.0011324,2283
Every piece of them has power.,low,0.7540983606557377,torontofantasy.6.111599,low.02284,torontofantasy.1603313,2284
The damage might already be done.,low,0.72,,low.02285,c4_-om2-data-public-allenai-c4-c4-en-c4-train.00470-of-01024.json.gz.01306639,2285
You still have time to plan.,low,0.65625,,low.02286,c4_-om2-data-public-allenai-c4-c4-en-c4-train.00242-of-01024.json.gz.03651708,2286
The problem must be faced squarely.,low,0.7142857142857143,brown.6.001147,low.02287,brown.022504,2287
Another manner is to time entries.,low,0.576271186440678,,low.02288,c4_-om2-data-public-allenai-c4-c4-en-c4-train.00961-of-01024.json.gz.00430395,2288
The last reported wind was calm.,low,0.7,cocaspok2011.6.004318,low.02289,cocaspok2011.0055041,2289
It must be great being you.,low,0.8571428571428571,cornellmov.6.030832,low.02290,cornellmov.0186949,2290
"Every word still clear, still sure.",low,0.6447368421052632,torontofantasy.6.186732,low.02291,torontofantasy.2534965,2291
We are full of literary people.,low,0.7236842105263158,wsj.6.002551,low.02292,wsj.464077,2292
Possibly the last of his kind.,low,0.68,torontofantasy.6.020194,low.02293,torontofantasy.293030,2293
You have to make it last.,low,0.7321428571428571,torontofantasy.6.126495,low.02294,torontofantasy.1742274,2294
Perhaps something he was searching for.,low,0.6190476190476191,torontofantasy.6.152230,low.02295,torontofantasy.2072037,2295
Economic issues must also be resolved.,low,0.7887323943661971,cocaspok2003.6.003284,low.02296,cocaspok2003.0056281,2296
Many of them have been flawless.,low,0.7377049180327869,cocaspok1992.6.003354,low.02297,cocaspok1992.0043364,2297
Aren't we full of ourselves today?,low,0.8311688311688312,cornellmov.6.018697,low.02298,cornellmov.0108882,2298
I will be worried about them.,low,0.6349206349206349,cocaspok2003.6.000879,low.02299,cocaspok2003.0017228,2299
Don't be afraid to be lazy.,low,0.9322033898305084,,low.02300,c4_-om2-data-public-allenai-c4-c4-en-c4-train.00480-of-01024.json.gz.02438405,2300
I feel very dependent on them.,low,0.76,cocaspok2001.6.005788,low.02301,cocaspok2001.0089720,2301
