sentence,condition,correct,sent_identifier,index,original_index,item_id
They can surgically alter the fingerprint.,filler,0.9755244755244755,cocaspok2002.6.000590,filler.03286,cocaspok2002.0010880,3286
And I wanted to make sure.,filler,0.8859315589353612,cocaspok1993.6.004051,filler.03287,cocaspok1993.0051793,3287
Also the video is really good!,filler,0.8972332015810277,,filler.03288,c4_-om2-data-public-allenai-c4-c4-en-c4-train.00961-of-01024.json.gz.04669706,3288
"Well, or my dad, you know.",filler,0.9372822299651568,cocaspok2006.6.003591,filler.03289,cocaspok2006.0059904,3289
Report Library is the default value.,filler,0.973384030418251,,filler.03290,c4_-om2-data-public-allenai-c4-c4-en-c4-train.00470-of-01024.json.gz.00776906,3290
Spotting 5 days before AF due???,filler,0.9769230769230769,,filler.03291,c4_-om2-data-public-allenai-c4-c4-en-c4-train.00514-of-01024.json.gz.04464650,3291
"But my question is this, Governor.",filler,0.9558823529411765,cocaspok2008.6.006495,filler.03292,cocaspok2008.0081194,3292
Tizanidine recreational use and high abuse.,filler,0.9618320610687023,,filler.03293,c4_-om2-data-public-allenai-c4-c4-en-c4-train.00470-of-01024.json.gz.04023199,3293
"If it is, I'm missing out.",filler,0.954225352112676,wsj.6.000219,filler.03294,wsj.040112,3294
What is Google's advanced verification process?,filler,0.94921875,,filler.03295,c4_-om2-data-public-allenai-c4-c4-en-c4-train.00196-of-01024.json.gz.04195932,3295
My first reaction was -- was disbelief.,vigilance,0.9163346613545816,cocaspok2007.6.000481,filler.03296,cocaspok2007.0005149,3296
All 155 people on board survived.,filler,0.9927272727272727,cocaspok2009.6.008098,filler.03297,cocaspok2009.0104298,3297
"You know that sounds crazy, right?",filler,0.8020477815699659,torontofantasy.6.318169,filler.03298,torontofantasy.4176343,3298
The company's U.S. business was drifting.,filler,0.9664179104477612,wsj.6.000044,filler.03299,wsj.008761,3299
That's how long you were gone.,filler,0.9169811320754717,cornellmov.6.007120,filler.03300,cornellmov.0040769,3300
He'll tell you all about it.,filler,0.8961937716262975,cornellmov.6.037547,filler.03301,cornellmov.0230090,3301
But three Hispanics in the Senate.,filler,0.977859778597786,cocaspok2006.6.009892,filler.03302,cocaspok2006.0147597,3302
They try to shred me apart.,filler,0.9664179104477612,cocaspok2009.6.007958,filler.03303,cocaspok2009.0102847,3303
"That's why we're here, Sheriff Cable.",filler,0.9283154121863799,cornellmov.6.025580,filler.03304,cornellmov.0153371,3304
"Born in 1977 in Onagawa, Japan.",filler,0.9682539682539683,,filler.03305,c4_-om2-data-public-allenai-c4-c4-en-c4-train.00727-of-01024.json.gz.04450953,3305
Ponder heard a scuffling behind him.,filler,0.9744525547445255,torontofantasy.6.118218,filler.03306,torontofantasy.1668181,3306
Maybe our viewers have some insight.,filler,0.9032258064516129,cocaspok2005.6.005275,filler.03307,cocaspok2005.0082520,3307
For bein' the way he is.,filler,0.9407407407407408,cornellmov.6.037228,filler.03308,cornellmov.0227933,3308
Located on the Tawam Hospital campus.,filler,0.951048951048951,,filler.03309,c4_-om2-data-public-allenai-c4-c4-en-c4-train.00470-of-01024.json.gz.00295142,3309
"Yes, and that's a great point.",filler,0.8267148014440433,cocaspok2007.6.007544,filler.03310,cocaspok2007.0097069,3310
Guide yourself through the ideas above.,filler,0.9464285714285714,,filler.03311,c4_-om2-data-public-allenai-c4-c4-en-c4-train.00196-of-01024.json.gz.04899204,3311
So what do we do now?,filler,0.7545787545787546,cornellmov.6.008821,filler.03312,cornellmov.0050564,3312
Do you have a lover now?,filler,0.966542750929368,cornellmov.6.010772,filler.03313,cornellmov.0061010,3313
Her mouth floundered open and closed..,filler,0.9558823529411765,torontofantasy.6.276221,filler.03314,torontofantasy.3615330,3314
"I'll be in charge, of course.",filler,0.9149797570850202,cornellmov.6.016596,filler.03315,cornellmov.0095213,3315
"Why email, why not agent them?",filler,0.966542750929368,,filler.03316,c4_-om2-data-public-allenai-c4-c4-en-c4-train.00242-of-01024.json.gz.03407711,3316
What is the condition of yours?,vigilance,0.9224806201550387,,filler.03317,c4_-om2-data-public-allenai-c4-c4-en-c4-train.00196-of-01024.json.gz.01153166,3317
He's on his way to Chicago.,filler,0.946969696969697,cornellmov.6.033375,filler.03318,cornellmov.0202938,3318
I'll see what I can do.,filler,0.7898832684824902,cornellmov.6.004655,filler.03319,cornellmov.0026207,3319
Or was that just Rand's interpretation?,vigilance,0.9275862068965517,torontofantasy.6.202858,filler.03320,torontofantasy.2751328,3320
Sarssen saw Bethel's look of disbelief..,vigilance,0.9522184300341296,torontofantasy.6.005788,filler.03321,torontofantasy.80913,3321
Susan halted Dean and kissed him.,filler,0.9397590361445783,brown.6.000022,filler.03322,brown.000178,3322
Tree engagement ring image 0 branch.,filler,0.972972972972973,,filler.03323,c4_-om2-data-public-allenai-c4-c4-en-c4-train.00480-of-01024.json.gz.03598794,3323
And I'll take care of it.,filler,0.7913385826771654,torontofantasy.6.254533,filler.03324,torontofantasy.3371072,3324
"Finally, our party needs a makeover!",filler,0.9545454545454546,,filler.03325,c4_-om2-data-public-allenai-c4-c4-en-c4-train.00918-of-01024.json.gz.03846112,3325
"You mean, early morning the 16th?",filler,0.9651162790697675,cornellmov.6.013317,filler.03326,cornellmov.0075613,3326
I don't know if I do.,filler,0.924812030075188,cocaspok1998.6.003476,filler.03327,cocaspok1998.0047146,3327
We're talking about what people want.,vigilance,0.900990099009901,cocaspok1991.6.006429,filler.03328,cocaspok1991.0111347,3328
The other is a leadership vote.,vigilance,0.9344827586206896,cocaspok2001.6.004376,filler.03329,cocaspok2001.0069332,3329
We gotta get outta the country!,filler,0.9366197183098591,cornellmov.6.029973,filler.03330,cornellmov.0181377,3330
It was clearly a circumstantial case.,filler,0.9354838709677419,cocaspok2009.6.005980,filler.03331,cocaspok2009.0076289,3331
And then the Secret Service called.,filler,0.966789667896679,wsj.6.000069,filler.03332,wsj.014074,3332
How can I say this diplomatically?,filler,0.945054945054945,wsj.6.001895,filler.03333,wsj.341280,3333
"That cost money, but so what?",filler,0.9730769230769231,wsj.6.001536,filler.03334,wsj.279919,3334
Community pavilion with river front access.,filler,0.9743589743589743,,filler.03335,c4_-om2-data-public-allenai-c4-c4-en-c4-train.00470-of-01024.json.gz.03052835,3335
Aimee J. is proof of that.,filler,0.9782608695652174,,filler.03336,c4_-om2-data-public-allenai-c4-c4-en-c4-train.00727-of-01024.json.gz.04452356,3336
It has the potential for abuse.,filler,0.8859315589353612,wsj.6.002058,filler.03337,wsj.372240,3337
Oh dreads on a white man.,filler,0.9787985865724381,,filler.03338,c4_-om2-data-public-allenai-c4-c4-en-c4-train.00368-of-01024.json.gz.04178760,3338
"Excuse me, I need to explain...",filler,0.9501915708812261,cornellmov.6.014059,filler.03339,cornellmov.0079972,3339
More than half the audience departed.,filler,0.9640287769784173,brown.6.001211,filler.03340,brown.024250,3340
Okay thank you for the reply.,filler,0.9245283018867925,,filler.03341,c4_-om2-data-public-allenai-c4-c4-en-c4-train.00918-of-01024.json.gz.02036761,3341
"We're good at this, very good.",filler,0.9146757679180887,,filler.03342,c4_-om2-data-public-allenai-c4-c4-en-c4-train.00196-of-01024.json.gz.03040816,3342
"However, it was a delicious cocktail!",filler,0.9294605809128631,,filler.03343,c4_-om2-data-public-allenai-c4-c4-en-c4-train.00514-of-01024.json.gz.04647375,3343
It also has a guest apartment.,filler,0.9603174603174603,wsj.6.002766,filler.03344,wsj.503725,3344
Let's get to the bottom line.,vigilance,0.9295302013422819,torontomyst.6.155164,filler.03345,torontomyst.1995713,3345
They have got to be relaxed.,filler,0.9264705882352942,cocaspok2006.6.005060,filler.03346,cocaspok2006.0081458,3346
Ares proudly claimed you as his.,vigilance,0.9555555555555556,torontofantasy.6.188934,filler.03347,torontofantasy.2567215,3347
Feeling sorry for him I laughed.,filler,0.9438202247191011,torontomyst.6.049661,filler.03348,torontomyst.697467,3348
It was a busy year too.,filler,0.9178571428571428,torontomyst.6.021883,filler.03349,torontomyst.301722,3349
"Fists swung, teeth snapped, legs kicked.",filler,0.9723320158102767,torontofantasy.6.278537,filler.03350,torontofantasy.3640064,3350
Somebody had tried to assassinate him!,filler,0.9484126984126984,torontofantasy.6.329421,filler.03351,torontofantasy.4301529,3351
"Young men, used up and discarded.",filler,0.9537366548042705,torontomyst.6.065417,filler.03352,torontomyst.908736,3352
I approached the light and froze.,filler,0.9550173010380623,torontofantasy.6.340502,filler.03353,torontofantasy.4485871,3353
It takes value to earn money.,filler,0.9318181818181818,,filler.03354,c4_-om2-data-public-allenai-c4-c4-en-c4-train.00961-of-01024.json.gz.01155721,3354
It didn't strike them as weird.,filler,0.9265734265734266,torontofantasy.6.169197,filler.03355,torontofantasy.2292979,3355
That's what Dave suggests might happen.,filler,0.9405594405594405,,filler.03356,c4_-om2-data-public-allenai-c4-c4-en-c4-train.00961-of-01024.json.gz.04481740,3356
I'd go nuts if I did.,filler,0.9540636042402827,cocaspok2005.6.001783,filler.03357,cocaspok2005.0032925,3357
Look out world... Here we come!,filler,0.9440298507462687,,filler.03358,c4_-om2-data-public-allenai-c4-c4-en-c4-train.00961-of-01024.json.gz.03719599,3358
"In jail again, or running away.",filler,0.9635036496350365,torontomyst.6.027861,filler.03359,torontomyst.394300,3359
Was it some kinda macho thing?,filler,0.959409594095941,cornellmov.6.024247,filler.03360,cornellmov.0144773,3360
Holden wondered how much actually did.,filler,0.9312977099236641,torontomyst.6.137519,filler.03361,torontomyst.1783113,3361
"My God, Tabitha look at yourself.",filler,0.9717314487632509,torontofantasy.6.217175,filler.03362,torontofantasy.2925427,3362
You're learning the Hebrew really fast.,filler,0.9768339768339769,cornellmov.6.014233,filler.03363,cornellmov.0080976,3363
Something tells me this means food.,filler,0.9403508771929825,cornellmov.6.021235,filler.03364,cornellmov.0124810,3364
There was nothing he didn't know.,filler,0.9069767441860465,cornellmov.6.026196,filler.03365,cornellmov.0157322,3365
This is his room... isn't it?,filler,0.9236363636363636,cornellmov.6.005004,filler.03366,cornellmov.0028135,3366
Just head out into the wilderness?,filler,0.9565217391304348,torontofantasy.6.379426,filler.03367,torontofantasy.4963247,3367
His chest barely seeming to rise.,filler,0.9755244755244755,torontomyst.6.166264,filler.03368,torontomyst.2131498,3368
Replacement parts are inexpensive through JumpKing.,filler,0.9774436090225563,,filler.03369,c4_-om2-data-public-allenai-c4-c4-en-c4-train.00480-of-01024.json.gz.03108817,3369
We're taking you to the hospital.,filler,0.9535714285714286,torontofantasy.6.134447,filler.03370,torontofantasy.1841996,3370
Is there a difference you know?,filler,0.9007633587786259,,filler.03371,c4_-om2-data-public-allenai-c4-c4-en-c4-train.00196-of-01024.json.gz.03173970,3371
We all enjoyed it very much.,filler,0.7622641509433963,,filler.03372,c4_-om2-data-public-allenai-c4-c4-en-c4-train.00727-of-01024.json.gz.02740907,3372
This is where they grew up.,vigilance,0.9256505576208178,cocaspok1999.6.008383,filler.03373,cocaspok1999.0110712,3373
The young girl is slashed again.,filler,0.9799196787148594,cornellmov.6.012876,filler.03374,cornellmov.0073332,3374
But we could wait all right.,filler,0.9430604982206405,brown.6.001078,filler.03375,brown.020905,3375
I know all of that now.,vigilance,0.8888888888888888,torontomyst.6.136505,filler.03376,torontomyst.1769566,3376
Only then did he step aside.,filler,0.9094202898550725,torontofantasy.6.264837,filler.03377,torontofantasy.3497132,3377
To make a long story short...,filler,0.905511811023622,cornellmov.6.009848,filler.03378,cornellmov.0056078,3378
I took another staff attorney instead.,filler,0.9340659340659341,torontofantasy.6.155991,filler.03379,torontofantasy.2123872,3379
I need to get up there.,filler,0.9227799227799228,torontofantasy.6.072238,filler.03380,torontofantasy.1067797,3380
Your owner's sins were his own.,filler,0.9481481481481482,torontofantasy.6.413446,filler.03381,torontofantasy.5418863,3381
"Oh, you guys are so cool.",filler,0.9261992619926199,cocaspok2010.6.011670,filler.03382,cocaspok2010.0151573,3382
"He was, unfortunately, out of luck.",filler,0.8156862745098039,torontoadv.6.027852,filler.03383,torontoadv.487897,3383
Given to women and children's complaints.,filler,0.9457364341085271,,filler.03384,c4_-om2-data-public-allenai-c4-c4-en-c4-train.00196-of-01024.json.gz.00749115,3384
The admissions scandal reopens old wounds.,filler,0.9490909090909091,,filler.03385,c4_-om2-data-public-allenai-c4-c4-en-c4-train.00480-of-01024.json.gz.00654458,3385
I had to move fast now.,filler,0.9038461538461539,torontomyst.6.060701,filler.03386,torontomyst.841897,3386
I like posts when you cook!,filler,0.9680851063829787,,filler.03387,c4_-om2-data-public-allenai-c4-c4-en-c4-train.00368-of-01024.json.gz.01671690,3387
We're talking about hamburgers and pies.,vigilance,0.9738805970149254,cocaspok2008.6.008279,filler.03388,cocaspok2008.0102283,3388
That's what Woodward and Bernstein know.,filler,0.9264705882352942,cocaspok1997.6.005941,filler.03389,cocaspok1997.0072787,3389
Doren reached for a second arrow.,filler,0.9458483754512635,torontofantasy.6.319613,filler.03390,torontofantasy.4195788,3390
You'll see it kick in online.,filler,0.9614035087719298,cocaspok2002.6.004415,filler.03391,cocaspok2002.0069804,3391
Here's a look at some markets.,vigilance,0.9244604316546763,wsj.6.002828,filler.03392,wsj.513390,3392
Jake heard voices through the walls.,filler,0.9251968503937008,torontomyst.6.154902,filler.03393,torontomyst.1992665,3393
"Now, men, women and heart disease.",filler,0.967741935483871,cocaspok2003.6.004458,filler.03394,cocaspok2003.0071153,3394
All the helpers were wearing jackets.,filler,0.966789667896679,,filler.03395,c4_-om2-data-public-allenai-c4-c4-en-c4-train.00368-of-01024.json.gz.04502152,3395
That's nearly 3 times more area!,filler,0.9638989169675091,,filler.03396,c4_-om2-data-public-allenai-c4-c4-en-c4-train.00918-of-01024.json.gz.00214484,3396
It was not predicted at all.,filler,0.8914728682170543,cocaspok2000.6.000595,filler.03397,cocaspok2000.0012332,3397
And he acknowledged -- look at that.,filler,0.9209486166007905,cocaspok2009.6.000816,filler.03398,cocaspok2009.0009520,3398
What is the schools' affiliate scheme?,filler,0.9611307420494699,,filler.03399,c4_-om2-data-public-allenai-c4-c4-en-c4-train.00491-of-01024.json.gz.00782318,3399
Oh please mother make it stop!,filler,0.9702602230483272,cornellmov.6.030698,filler.03400,cornellmov.0186058,3400
I think it's more the communication.,filler,0.9207547169811321,cocaspok2010.6.006579,filler.03401,cocaspok2010.0085954,3401
Gia breathed in the coffee aroma.,vigilance,0.9568627450980393,torontomyst.6.036446,filler.03402,torontomyst.515539,3402
Recipe turned out great thank you.,filler,0.9321428571428572,,filler.03403,c4_-om2-data-public-allenai-c4-c4-en-c4-train.00242-of-01024.json.gz.02650352,3403
May the beauty be with you!,filler,0.9621212121212122,,filler.03404,c4_-om2-data-public-allenai-c4-c4-en-c4-train.00480-of-01024.json.gz.04988776,3404
You've been here from the start.,filler,0.9037037037037037,cornellmov.6.002335,filler.03405,cornellmov.0013202,3405
Being violently ill to her tummy.,filler,0.9768339768339769,cornellmov.6.006405,filler.03406,cornellmov.0036504,3406
So what did I think about?,filler,0.9054545454545454,,filler.03407,c4_-om2-data-public-allenai-c4-c4-en-c4-train.00727-of-01024.json.gz.00023190,3407
All submissions are made on spec.,filler,0.9484536082474226,,filler.03408,c4_-om2-data-public-allenai-c4-c4-en-c4-train.00961-of-01024.json.gz.01144693,3408
I've learned how to make money.,filler,0.9423076923076923,cocaspok1999.6.000500,filler.03409,cocaspok1999.0008350,3409
The trouble of course is guilt.,filler,0.9481481481481482,,filler.03410,c4_-om2-data-public-allenai-c4-c4-en-c4-train.00368-of-01024.json.gz.04476513,3410
John was good at his job.,filler,0.9722222222222222,brown.6.001303,filler.03411,brown.025521,3411
But he certainly was not sober.,vigilance,0.921875,torontofantasy.6.296203,filler.03412,torontofantasy.3878506,3412
We're missing three and the Sergeant.,filler,0.8961538461538462,cornellmov.6.016746,filler.03413,cornellmov.0096383,3413
Savannah stirs briefly in my arms.,filler,0.9584905660377359,torontofantasy.6.043278,filler.03414,torontofantasy.629422,3414
"Vijay Vaitheeswaran of ""The Economist"" magazine.",vigilance,0.950381679389313,cocaspok2001.6.004275,filler.03415,cocaspok2001.0068027,3415
We should not fight each other.,vigilance,0.916083916083916,cocaspok2006.6.000564,filler.03416,cocaspok2006.0008564,3416
"You wanna eat them, don't you!",vigilance,0.9400749063670412,,filler.03417,c4_-om2-data-public-allenai-c4-c4-en-c4-train.00918-of-01024.json.gz.04016788,3417
I tried something like 30 times.,filler,1.0,cornellmov.6.025183,filler.03418,cornellmov.0150889,3418
So now you'll have a mother.,vigilance,0.9776119402985075,cornellmov.6.011679,filler.03419,cornellmov.0066249,3419
"Well, I'm a little confused here.",filler,0.8204081632653061,cornellmov.6.007729,filler.03420,cornellmov.0044131,3420
But I didn't want him dead.,vigilance,0.9205776173285198,torontomyst.6.113565,filler.03421,torontomyst.1503155,3421
"Go ahead, it's no big deal.",filler,0.8136200716845878,torontomyst.6.074008,filler.03422,torontomyst.1021489,3422
These were not tourists with Instamatics.,vigilance,0.974169741697417,wsj.6.001012,filler.03423,wsj.186953,3423
That's how we'll get to him.,filler,0.9175627240143369,cornellmov.6.032462,filler.03424,cornellmov.0197327,3424
That's what I been thinkin' about.,vigilance,0.895910780669145,cornellmov.6.038252,filler.03425,cornellmov.0234674,3425
This in contast to the gastropods.,filler,0.9467680608365019,,filler.03426,c4_-om2-data-public-allenai-c4-c4-en-c4-train.00470-of-01024.json.gz.03442361,3426
"But it hasn't been bliss, either.",filler,0.9328358208955224,wsj.6.001424,filler.03427,wsj.259931,3427
I want my body fixed now.,vigilance,0.9630996309963099,cocaspok1991.6.000201,filler.03428,cocaspok1991.0003216,3428
It's the most obvious solution: Escape.,filler,0.9608540925266904,cornellmov.6.023986,filler.03429,cornellmov.0142963,3429
Exclusive same day service in Minneapolis.,filler,0.9645390070921985,,filler.03430,c4_-om2-data-public-allenai-c4-c4-en-c4-train.00514-of-01024.json.gz.02336059,3430
We've been doing it for decades.,filler,0.8860759493670886,cocaspok2011.6.010671,filler.03431,cocaspok2011.0136662,3431
Allison's green eyes sparkled with excitement.,filler,0.9421768707482994,torontomyst.6.099307,filler.03432,torontomyst.1316648,3432
Kill me and you destroy yourself.,filler,0.9737827715355806,torontomyst.6.044804,filler.03433,torontomyst.631314,3433
"We should just, well, make sure.",filler,0.9084249084249084,torontofantasy.6.299351,filler.03434,torontofantasy.3922828,3434
We're creating more excitement and traffic.,filler,0.9037037037037037,wsj.6.000533,filler.03435,wsj.097599,3435
Not another one of the Garde.,filler,0.9436619718309859,torontofantasy.6.160253,filler.03436,torontofantasy.2179737,3436
That's another way of putting it.,filler,0.8678571428571429,cocaspok2005.6.007113,filler.03437,cocaspok2005.0109161,3437
Spasticity is caused by burkholderia mallei.,filler,0.98828125,,filler.03438,c4_-om2-data-public-allenai-c4-c4-en-c4-train.00514-of-01024.json.gz.02432402,3438
There's nothing coming on back here.,filler,0.9518518518518518,cocaspok1990.6.000231,filler.03439,cocaspok1990.0003967,3439
Now off to the putting green.,filler,0.96875,cocaspok1993.6.001673,filler.03440,cocaspok1993.0023327,3440
But he is in New Orleans.,filler,0.9595588235294118,torontomyst.6.166029,filler.03441,torontomyst.2129808,3441
And I'm bored with this prattle.,filler,0.9817518248175182,cornellmov.6.032831,filler.03442,cornellmov.0199676,3442
"Share bath, maybe -- but share refrigerator??",filler,0.9922178988326849,brown.6.001351,filler.03443,brown.025993,3443
Kaidan Rowe was a Hottie McHotters.,filler,0.9442379182156134,torontofantasy.6.238071,filler.03444,torontofantasy.3169020,3444
These people don't even know me.,filler,0.9114391143911439,wsj.6.001168,filler.03445,wsj.211553,3445
The switchboard is lightening up downtown.,filler,0.9525423728813559,cornellmov.6.028597,filler.03446,cornellmov.0172641,3446
One thing was becoming increasingly sure.,filler,0.9101123595505618,brown.6.001233,filler.03447,brown.024694,3447
Amanda followed close on his heels.,filler,0.9568627450980393,torontoadv.6.018036,filler.03448,torontoadv.319805,3448
You want me to sing something?,filler,0.9266409266409267,cornellmov.6.036299,filler.03449,cornellmov.0222082,3449
Mac steadied his voice with effort..,filler,0.9705882352941176,torontomyst.6.158185,filler.03450,torontomyst.2034173,3450
Ross and Associates represented the buyers.,filler,0.9368421052631579,wsj.6.002303,filler.03451,wsj.418336,3451
We accepted the FBI files matter.,filler,0.9494163424124513,cocaspok1999.6.007486,filler.03452,cocaspok1999.0099357,3452
I have friends in King's Landing.,vigilance,0.942652329749104,torontofantasy.6.466543,filler.03453,torontofantasy.6064446,3453
Greet my flowers in trembling bliss?,filler,0.974169741697417,,filler.03454,c4_-om2-data-public-allenai-c4-c4-en-c4-train.00242-of-01024.json.gz.02803475,3454
Others information are not edited usually.,filler,0.9530685920577617,,filler.03455,c4_-om2-data-public-allenai-c4-c4-en-c4-train.00196-of-01024.json.gz.01175647,3455
Please developer just get a queue.,vigilance,0.9628252788104089,,filler.03456,c4_-om2-data-public-allenai-c4-c4-en-c4-train.00480-of-01024.json.gz.00332700,3456
Only his two sons understood him.,filler,0.9490909090909091,torontoadv.6.050724,filler.03457,torontoadv.854201,3457
All Karen women seem to smoke.,vigilance,0.981549815498155,,filler.03458,c4_-om2-data-public-allenai-c4-c4-en-c4-train.00480-of-01024.json.gz.02935428,3458
What a shocking thing to say!,filler,0.91015625,torontofantasy.6.095143,filler.03459,torontofantasy.1391967,3459
Now the region is heavily populated.,filler,0.9328621908127208,cocaspok2006.6.000567,filler.03460,cocaspok2006.0008637,3460
There were chairs for twenty visitors.,filler,0.9724137931034482,torontomyst.6.039315,filler.03461,torontomyst.560840,3461
They were in the war together.,filler,0.9357142857142857,wsj.6.001096,filler.03462,wsj.200550,3462
"Spare yourself the humiliation, the degradation...",filler,0.9176029962546817,cornellmov.6.040632,filler.03463,cornellmov.0250552,3463
We're here for your entrepreneurial endeavors!,vigilance,0.8830188679245283,,filler.03464,c4_-om2-data-public-allenai-c4-c4-en-c4-train.00918-of-01024.json.gz.03079479,3464
"And on Pyke, there as well.",filler,0.9671532846715328,torontofantasy.6.463017,filler.03465,torontofantasy.6021428,3465
The night was too quiet then.,filler,0.9323308270676691,torontofantasy.6.448133,filler.03466,torontofantasy.5831928,3466
"You know, keep your shirt on.",filler,0.9713261648745519,cocaspok2010.6.002865,filler.03467,cocaspok2010.0036963,3467
Apollo speared him with his scowl.,filler,0.9377289377289377,torontofantasy.6.294746,filler.03468,torontofantasy.3851697,3468
Only the philosopher knows the truth.,filler,0.9634146341463414,brown.6.000297,filler.03469,brown.005054,3469
"There's no ands, ifs or buts.",filler,0.9659090909090909,cocaspok1990.6.000051,filler.03470,cocaspok1990.0000880,3470
I was sorry about those decisions.,filler,0.951417004048583,cocaspok1995.6.003609,filler.03471,cocaspok1995.044307,3471
"Hard hats, bulldozers and lunch provided.",filler,0.9622641509433962,wsj.6.002018,filler.03472,wsj.365248,3472
What are some carpal tunnel treatments?,filler,0.9849624060150376,,filler.03473,c4_-om2-data-public-allenai-c4-c4-en-c4-train.00368-of-01024.json.gz.04746890,3473
He gave me one final hug..,filler,0.9247311827956989,torontomyst.6.152299,filler.03474,torontomyst.1957189,3474
Always recommend them to my friends.,filler,0.9333333333333333,,filler.03475,c4_-om2-data-public-allenai-c4-c4-en-c4-train.00491-of-01024.json.gz.01504324,3475
So it needs that artistic flair.,filler,0.9304029304029304,,filler.03476,c4_-om2-data-public-allenai-c4-c4-en-c4-train.00491-of-01024.json.gz.01916686,3476
"Well, that close to 50 pounds.",filler,0.9786476868327402,cocaspok1997.6.006876,filler.03477,cocaspok1997.0084287,3477
"Bloomberg said it is ""not interested"".",filler,0.9683098591549296,wsj.6.002920,filler.03478,wsj.529832,3478
And I turned my head slightly.,vigilance,0.9076923076923077,torontofantasy.6.307672,filler.03479,torontofantasy.4036015,3479
I will look further into this.,filler,0.8315018315018315,,filler.03480,c4_-om2-data-public-allenai-c4-c4-en-c4-train.00961-of-01024.json.gz.01463137,3480
Who said I was a lady?,filler,0.9664179104477612,cornellmov.6.001604,filler.03481,cornellmov.0008810,3481
Or maybe I call you -- tonight??,filler,0.9399293286219081,brown.6.000970,filler.03482,brown.019543,3482
All these need to be enquired.,filler,0.9481481481481482,,filler.03483,c4_-om2-data-public-allenai-c4-c4-en-c4-train.00961-of-01024.json.gz.04784254,3483
I was a mentor to her.,filler,0.9103448275862069,cornellmov.6.010352,filler.03484,cornellmov.0058971,3484
"Lives and works in Nashville, TN.",filler,0.9430604982206405,,filler.03485,c4_-om2-data-public-allenai-c4-c4-en-c4-train.00196-of-01024.json.gz.04769804,3485
Thal tested the other two pistols.,filler,0.9740740740740741,torontofantasy.6.011488,filler.03486,torontofantasy.170344,3486
Mister Seor Love Daddy is cool.,filler,0.9755244755244755,cornellmov.6.008665,filler.03487,cornellmov.0049646,3487
Or at least live apart peacefully.,filler,0.9411764705882353,wsj.6.000427,filler.03488,wsj.077629,3488
